{
  "key": "example_standard_terms",
  "title": "Example Standard Terms And Conditions",
  "locale_code": "en_US",
  "body_markdown": "1. DEFINITIONS\n1.1 \"Service\" means the service described in the document.\n\n2. TERM\n2.1 The term begins on the effective date.",
  "revision_label": "Rev. Feb. 24, 2026",
  "effective_from": "2026-02-24",
  "source_url": "https://legal.example.com/contracts/standard/terms/v2026-02-24",
  "render_profile": "legal-markdown-v1",
  "tags": [
    "example",
    "standard-terms"
  ],
  "metadata": {
    "example_notice": "Illustrative fixture; adapter owns concrete policy keys, scope names and approval metadata.",
    "owner_team": "legal",
    "approved_by": "example-approver"
  }
}
